{
  "version": 1,
  "title": "PII discoveries",
  "category": "sensitivity",
  "subtitle": "Content-scan findings",
  "panels": [
    {
      "id": "k1",
      "kind": "kpi",
      "title": "PII columns",
      "query": "pii_discoveries",
      "span": 1
    },
    {
      "id": "k2",
      "kind": "kpi",
      "title": "PII types",
      "query": "pii_discoveries",
      "span": 1
    },
    {
      "id": "k3",
      "kind": "kpi",
      "title": "Masked",
      "query": "masking_status",
      "span": 1
    },
    {
      "id": "k4",
      "kind": "kpi",
      "title": "In high-sens assets",
      "query": "pii_discoveries",
      "span": 1
    },
    {
      "id": "c1",
      "kind": "chart",
      "title": "Content-scan discoveries",
      "query": "pii_discoveries",
      "chartType": "bar",
      "bindings": {
        "category": "pii_type",
        "value": "count"
      },
      "span": 2
    },
    {
      "id": "c2",
      "kind": "chart",
      "title": "PII by source",
      "query": "pii_discoveries",
      "chartType": "bar",
      "bindings": {
        "category": "source",
        "value": "count"
      },
      "span": 2
    },
    {
      "id": "t1",
      "kind": "table",
      "title": "Assets containing PII",
      "query": "pii_assets",
      "span": 4
    }
  ]
}