{
  "version": 1,
  "title": "DQ dimensions",
  "category": "quality",
  "subtitle": "The dimensions behind the score",
  "panels": [
    {
      "id": "k1",
      "kind": "kpi",
      "title": "Completeness",
      "query": "dq_dimensions",
      "span": 1
    },
    {
      "id": "k2",
      "kind": "kpi",
      "title": "Accuracy",
      "query": "dq_dimensions",
      "span": 1
    },
    {
      "id": "k3",
      "kind": "kpi",
      "title": "Validity",
      "query": "dq_dimensions",
      "span": 1
    },
    {
      "id": "k4",
      "kind": "kpi",
      "title": "Consistency",
      "query": "dq_dimensions",
      "span": 1
    },
    {
      "id": "c1",
      "kind": "chart",
      "title": "DQ dimensions",
      "query": "dq_dimensions",
      "chartType": "radar",
      "bindings": {
        "category": "dimension",
        "value": "value"
      },
      "span": 2
    },
    {
      "id": "c2",
      "kind": "chart",
      "title": "Dimension scores",
      "query": "dq_dimensions",
      "chartType": "bar",
      "bindings": {
        "category": "dimension",
        "value": "value"
      },
      "span": 2
    },
    {
      "id": "c3",
      "kind": "chart",
      "title": "Dimensions by source",
      "query": "dq_by_source",
      "chartType": "stackedBar",
      "bindings": {
        "category": "source",
        "value": "value",
        "series": "dimension"
      },
      "span": 4
    }
  ]
}