{
  "version": 1,
  "title": "Scan operations",
  "category": "system",
  "subtitle": "Throughput, freshness & the fix queue",
  "panels": [
    {
      "id": "k1",
      "kind": "kpi",
      "title": "Scans 14d",
      "query": "scan_activity",
      "span": 1
    },
    {
      "id": "k2",
      "kind": "kpi",
      "title": "Profiled assets",
      "query": "profile_status",
      "span": 1
    },
    {
      "id": "k3",
      "kind": "kpi",
      "title": "Workers active",
      "query": "worker_status",
      "span": 1
    },
    {
      "id": "k4",
      "kind": "kpi",
      "title": "Failed scans",
      "query": "stale_failed",
      "span": 1
    },
    {
      "id": "c1",
      "kind": "chart",
      "title": "Daily scan volume",
      "query": "scan_activity",
      "chartType": "line",
      "bindings": {
        "x": "date",
        "y": "count"
      },
      "span": 2
    },
    {
      "id": "c2",
      "kind": "chart",
      "title": "Profiled assets",
      "query": "profile_status",
      "chartType": "gauge",
      "bindings": {
        "value": "count"
      },
      "span": 2
    },
    {
      "id": "t1",
      "kind": "table",
      "title": "Fix queue",
      "query": "stale_failed",
      "span": 4
    }
  ]
}