{
  "version": 1,
  "title": "Timeliness",
  "category": "quality",
  "subtitle": "DQ dimension \u00b7 stale since last load",
  "panels": [
    {
      "id": "k1",
      "kind": "kpi",
      "title": "Timeliness score",
      "query": "dq_timeliness",
      "span": 1
    },
    {
      "id": "k2",
      "kind": "kpi",
      "title": "Mean quality",
      "query": "quality_by_source",
      "span": 1
    },
    {
      "id": "c1",
      "kind": "chart",
      "title": "Timeliness score",
      "query": "dq_timeliness",
      "chartType": "gauge",
      "bindings": {
        "value": "score"
      },
      "span": 2
    },
    {
      "id": "c2",
      "kind": "chart",
      "title": "Timeliness by source",
      "query": "dq_timeliness",
      "chartType": "bar",
      "bindings": {
        "category": "source",
        "value": "score"
      },
      "span": 2
    },
    {
      "id": "c3",
      "kind": "chart",
      "title": "Scan & profile activity",
      "query": "scan_activity",
      "chartType": "line",
      "bindings": {
        "x": "date",
        "y": "count"
      },
      "span": 2
    },
    {
      "id": "x1",
      "kind": "text",
      "title": "What Timeliness measures",
      "query": "dq_timeliness",
      "markdown": "**Is the data fresh enough to use?** Age since the last successful load or scan against the agreed refresh window. **How to move it:** scan scheduling \u2014 batch sources age between loads.",
      "span": 2
    },
    {
      "id": "t1",
      "kind": "table",
      "title": "Fix queue \u2014 stale since last load",
      "query": "dq_timeliness",
      "span": 4
    }
  ]
}