{
  "version": 1,
  "title": "Trust deep-dive",
  "category": "governance",
  "subtitle": "The trust spectrum, source by source",
  "panels": [
    {
      "id": "k1",
      "kind": "kpi",
      "title": "Highly trusted",
      "query": "trust_distribution",
      "span": 1
    },
    {
      "id": "k2",
      "kind": "kpi",
      "title": "Term coverage",
      "query": "term_coverage",
      "span": 1
    },
    {
      "id": "k3",
      "kind": "kpi",
      "title": "Lineage verified",
      "query": "lineage_status",
      "span": 1
    },
    {
      "id": "k4",
      "kind": "kpi",
      "title": "Untermed critical",
      "query": "untermed_critical",
      "span": 1
    },
    {
      "id": "c1",
      "kind": "chart",
      "title": "Trust spectrum",
      "query": "trust_distribution",
      "chartType": "bar",
      "bindings": {
        "category": "bucket",
        "value": "count"
      },
      "span": 2,
      "options": {
        "scoreBands": true
      }
    },
    {
      "id": "c2",
      "kind": "chart",
      "title": "Trust by source",
      "query": "trust_by_source",
      "chartType": "stackedBar",
      "bindings": {
        "category": "source",
        "value": "count",
        "series": "bucket"
      },
      "span": 2
    },
    {
      "id": "c3",
      "kind": "chart",
      "title": "Coverage trend",
      "query": "coverage_trend",
      "chartType": "line",
      "bindings": {
        "x": "week",
        "y": "pct"
      },
      "span": 2
    },
    {
      "id": "t1",
      "kind": "table",
      "title": "Untermed critical elements",
      "query": "untermed_critical",
      "span": 2
    }
  ]
}